{
  "$schema": "https://json-schema.org/draft/2020-12/schema",
  "title": "Employee egress input qualification v5 result",
  "type": "object",
  "additionalProperties": false,
  "required": ["schemaVersion", "preparationWorkPackageId", "workPackageId", "gateId", "runId", "manifestSha256", "authorizationReference", "status", "reason", "fieldPresence", "counts", "safety", "history", "lifecycleSha256"],
  "properties": {
    "schemaVersion": {"const": 5},
    "preparationWorkPackageId": {"const": "WP-EMP-EGRESS-INPUT-QUALIFY-05-PREP"},
    "workPackageId": {"const": "WP-EMP-EGRESS-INPUT-QUALIFY-05"},
    "gateId": {"const": "GATE-049"},
    "runId": {"const": "employee-egress-input-qualification-v5-20260816-candidate-05"},
    "manifestSha256": {"type": "string", "pattern": "^[0-9a-f]{64}$"},
    "authorizationReference": {"const": "P3_00:GATE-049"},
    "status": {"enum": ["qualified", "not_qualified", "failed", "failed_cleanup_required"]},
    "reason": {"enum": ["none", "identifier_conflict", "database_operation_failed", "insert_count_invalid", "fingerprint_mismatch", "employee_request_failed", "employee_result_invalid", "egress_projection_invalid", "cleanup_count_invalid", "cleanup_verification_failed", "host_execution_failed", "log_leak_detected"]},
    "fieldPresence": {
      "type": "object",
      "additionalProperties": false,
      "required": ["codec", "requiredUser", "egressAllowed"],
      "properties": {
        "codec": {"type": "object", "additionalProperties": false, "required": ["idCardNo", "chineseName", "position", "workBaseSi"], "properties": {"idCardNo": {"type": "boolean"}, "chineseName": {"type": "boolean"}, "position": {"type": "boolean"}, "workBaseSi": {"type": "boolean"}}},
        "requiredUser": {"type": "object", "additionalProperties": false, "required": ["employeeIdMasked", "chineseName"], "properties": {"employeeIdMasked": {"type": "boolean"}, "chineseName": {"type": "boolean"}}},
        "egressAllowed": {"type": "boolean"}
      }
    },
    "counts": {
      "type": "object",
      "additionalProperties": false,
      "required": ["databaseSelectStarted", "databaseSelectTerminal", "databaseInsertStarted", "databaseInsertTerminal", "databaseDeleteStarted", "databaseDeleteTerminal", "preexisting", "inserted", "verified", "deleted", "remaining", "employeeDetailStarted", "employeeDetailTerminal", "otherEmployeeEndpoints", "modelCalls", "retryCount", "resumeCount"],
      "properties": {
        "databaseSelectStarted": {"type": "integer", "minimum": 0, "maximum": 3},
        "databaseSelectTerminal": {"type": "integer", "minimum": 0, "maximum": 3},
        "databaseInsertStarted": {"type": "integer", "minimum": 0, "maximum": 1},
        "databaseInsertTerminal": {"type": "integer", "minimum": 0, "maximum": 1},
        "databaseDeleteStarted": {"type": "integer", "minimum": 0, "maximum": 1},
        "databaseDeleteTerminal": {"type": "integer", "minimum": 0, "maximum": 1},
        "preexisting": {"type": "integer", "minimum": 0, "maximum": 1},
        "inserted": {"type": "integer", "minimum": 0, "maximum": 1},
        "verified": {"type": "integer", "minimum": 0, "maximum": 1},
        "deleted": {"type": "integer", "minimum": 0, "maximum": 1},
        "remaining": {"type": "integer", "minimum": 0, "maximum": 1},
        "employeeDetailStarted": {"type": "integer", "minimum": 0, "maximum": 1},
        "employeeDetailTerminal": {"type": "integer", "minimum": 0, "maximum": 1},
        "otherEmployeeEndpoints": {"const": 0},
        "modelCalls": {"const": 0},
        "retryCount": {"const": 0},
        "resumeCount": {"const": 0}
      }
    },
    "safety": {"type": "object", "additionalProperties": false, "required": ["synthetic", "nonRealIdentifier", "identifierPersisted", "jwtPersisted", "fieldValuesPersisted", "rawResponsePersisted", "llmApiKeyRead", "modelOutbound", "existingRowsModified", "logLeakCount", "rawLogsDeleted"], "properties": {"synthetic": {"const": true}, "nonRealIdentifier": {"const": true}, "identifierPersisted": {"const": false}, "jwtPersisted": {"const": false}, "fieldValuesPersisted": {"const": false}, "rawResponsePersisted": {"const": false}, "llmApiKeyRead": {"const": false}, "modelOutbound": {"const": false}, "existingRowsModified": {"const": 0}, "logLeakCount": {"type": "integer", "minimum": 0}, "rawLogsDeleted": {"const": true}}},
    "history": {"type": "array", "minItems": 17, "maxItems": 17, "items": {"type": "object", "additionalProperties": false, "required": ["kind", "path", "sha256"], "properties": {"kind": {"type": "string"}, "path": {"type": "string"}, "sha256": {"type": "string", "pattern": "^[0-9a-f]{64}$"}}}},
    "lifecycleSha256": {"type": "string", "pattern": "^[0-9a-f]{64}$"}
  }
}
