{"authorizationReference":"P3_00:GATE-049","counts":{"databaseDeleteStarted":1,"databaseDeleteTerminal":1,"databaseInsertStarted":1,"databaseInsertTerminal":1,"databaseSelectStarted":3,"databaseSelectTerminal":3,"deleted":1,"employeeDetailStarted":1,"employeeDetailTerminal":1,"inserted":1,"modelCalls":0,"otherEmployeeEndpoints":0,"preexisting":0,"remaining":0,"resumeCount":0,"retryCount":0,"verified":1},"fieldPresence":{"codec":{"chineseName":false,"idCardNo":false,"position":false,"workBaseSi":false},"egressAllowed":false,"requiredUser":{"chineseName":false,"employeeIdMasked":false}},"gateId":"GATE-049","history":[{"kind":"qualification_v4_manifest","path":"agent-runtime/tests/integration/adapters/employee/evidence/employee-egress-input-qualification-v4-20260816-candidate-04.manifest.json","sha256":"7dcae58a2a503a97fe89de0d01e63cb0450ccb0dd5945e4da5947d2df0875bb9"},{"kind":"qualification_v4_authorization","path":"agent-runtime/tests/integration/adapters/employee/evidence/employee-egress-input-qualification-v4-20260816-candidate-04.authorization.json","sha256":"e49c063ef6d93ab1395179fb5ae4026fc10da577108b676db0b5762f68274d98"},{"kind":"qualification_v4_host_lifecycle","path":"agent-runtime/tests/integration/adapters/employee/evidence/employee-egress-input-qualification-v4-20260816-candidate-04.host-lifecycle.jsonl","sha256":"73bd37aaec1c3c57d7debea5f1120cd3cff828057bcaee84afbdb4495658472a"},{"kind":"qualification_v4_lifecycle","path":"agent-runtime/tests/integration/adapters/employee/evidence/employee-egress-input-qualification-v4-20260816-candidate-04.lifecycle.jsonl","sha256":"aa2479fc8051cb4741f9826b81521583285ede692d31b9c6bed01bf1b2a922c3"},{"kind":"qualification_v4_result","path":"agent-runtime/tests/integration/adapters/employee/evidence/employee-egress-input-qualification-v4-20260816-candidate-04.result.json","sha256":"757bd4840143bbe5158facec89f7035cf72f99eac88b4c345d70cbc8ea0b5975"},{"kind":"qualification_v4_history_test","path":"agent-runtime/tests/integration/adapters/employee/test_employee_egress_input_qualification_v4_history.py","sha256":"e43e9c9a9353cd77ea7fa907ddd98ad8b0971a4c4c4853acde3683b32d570eda"},{"kind":"qualification_v3_manifest","path":"agent-runtime/tests/integration/adapters/employee/evidence/employee-egress-input-qualification-v3-20260814-candidate-03.manifest.json","sha256":"495063a328af6a233f5600bd4efff31fdae5ab4e28aad8287bfce194051680dd"},{"kind":"qualification_v3_authorization","path":"agent-runtime/tests/integration/adapters/employee/evidence/employee-egress-input-qualification-v3-20260814-candidate-03.authorization.json","sha256":"b772119e66b98ceec73738653a0033f6e2c1752e8fae8944f8eabea8d7ad74ad"},{"kind":"qualification_v3_pre_sql_failure","path":"agent-runtime/tests/integration/adapters/employee/evidence/employee-egress-input-qualification-v3-20260814-candidate-03.pre-sql-failure.json","sha256":"bfe4976f9a962bd1f7b9ed870176faefc4fbb742bf9b991cb07bba866a218d77"},{"kind":"qualification_v2_manifest","path":"agent-runtime/tests/integration/adapters/employee/evidence/employee-egress-input-qualification-v2-20260814-candidate-02.manifest.json","sha256":"6d853ecee412a734f111d1d30740a703fe0343593560b7b01ed4c5194dfdb66f"},{"kind":"qualification_v2_authorization","path":"agent-runtime/tests/integration/adapters/employee/evidence/employee-egress-input-qualification-v2-20260814-candidate-02.authorization.json","sha256":"c49f3bc23b6131506431b98697bb9dd35bc2d33200b29a1e507d845c95b587e1"},{"kind":"qualification_v2_lifecycle","path":"agent-runtime/tests/integration/adapters/employee/evidence/employee-egress-input-qualification-v2-20260814-candidate-02.lifecycle.jsonl","sha256":"570295951f8bf1a109156c017c30609ca548bfba3f021bff4cd2825f978ac231"},{"kind":"qualification_v2_result","path":"agent-runtime/tests/integration/adapters/employee/evidence/employee-egress-input-qualification-v2-20260814-candidate-02.result.json","sha256":"7534b1d04a1512720dcbee1fe630114fb1f08bf9c3615dec1d2cb18bec4d5054"},{"kind":"fixture_v1_manifest","path":"agent-runtime/tests/integration/adapters/employee/evidence/employee-synthetic-fixture-v1-20260814-candidate-01.manifest.json","sha256":"e0c74e5a21d4b80c292cf20266227f7c8f1a11037d1816a6513f6de604e98b11"},{"kind":"fixture_v1_authorization","path":"agent-runtime/tests/integration/adapters/employee/evidence/employee-synthetic-fixture-v1-20260814-candidate-01.authorization.json","sha256":"00e44c6df2d04edbc03ee9eaa51541041b6263a73bc91c3fdf9ed57bf11c3a2f"},{"kind":"fixture_v1_lifecycle","path":"agent-runtime/tests/integration/adapters/employee/evidence/employee-synthetic-fixture-v1-20260814-candidate-01.lifecycle.jsonl","sha256":"4d5ab81e68d24ac76a7c1d6f7b1a57204b7cb81c99f40f93afe444f4077f5b6c"},{"kind":"fixture_v1_result","path":"agent-runtime/tests/integration/adapters/employee/evidence/employee-synthetic-fixture-v1-20260814-candidate-01.result.json","sha256":"f0003ec559fa4606edda2982f0ae6878bfa066262168236128705d0c40aa0e4a"}],"lifecycleSha256":"442dfc7e88aa6a02689e0431805311e71e384ea19c53761da609b72b88ea318f","manifestSha256":"8b44a38ad6a02edd6db64b7c8e5fd02adee67a19ff1e9ef08e2ed3eb82f5ff74","preparationWorkPackageId":"WP-EMP-EGRESS-INPUT-QUALIFY-05-PREP","reason":"employee_result_invalid","runId":"employee-egress-input-qualification-v5-20260816-candidate-05","safety":{"existingRowsModified":0,"fieldValuesPersisted":false,"identifierPersisted":false,"jwtPersisted":false,"llmApiKeyRead":false,"logLeakCount":0,"modelOutbound":false,"nonRealIdentifier":true,"rawLogsDeleted":true,"rawResponsePersisted":false,"synthetic":true},"schemaVersion":5,"status":"failed","workPackageId":"WP-EMP-EGRESS-INPUT-QUALIFY-05"}
